title,link,content
Государственная регистрация смерти,https://gu.spb.ru/187847/,"Чтобы получить свидетельство о смерти, необходимо подать заявление в отдел ЗАГС, расположенный по последнему месту жительства умершего, месту наступления смерти или месту нахождения организации, которая выдала документ подтверждающий смерть.Если человек умер на судне, в поезде или самолете, регистрацию смерти производит соответствующий орган, на территории которого его сняли с транспортного средства. Если же смерть наступила в экспедиции, на полярной станции или в местности, где нет органов ЗАГС, регистрация производится ближайшим компетентным органом.Заявление о смерти нужно подать не позже3 днейс момента наступления смерти.Если у умершего отсутствует адрес регистрации по последнему месту жительства либо адрес регистрации не в Санкт-Петербурге, то документ установленной формы о смерти, выданный медицинской организацией или индивидуальным предпринимателем, осуществляющим медицинскую деятельность, должен быть выдан в Санкт-Петербурге, либо место жительства родителей (одного из родителей), детей, пережившего супруга должно быть в Санкт-Петербурге, либо решение суда об установлении факта смерти или об объявлении лица умершим должно быть вынесено районным судом Санкт-Петербурга. Заявление могут подать следующие лица:Супруг (супруга), другие члены семьи умершего, а также любое другое лицо, присутствовавшее в момент смерти или иным образом информированное о наступлении смерти.Руководитель медицинской организации, в которой происходили роды или в которой ребенок умер, либо врач, который установил факт смерти ребенка, умершего на первой неделе жизни.Индивидуальный предприниматель, осуществляющий медицинскую деятельность, установивший факт смерти ребенка, умершего на первой неделе жизни (при родах вне медицинской организации).Должностное лицо медицинской организации или организации социального обслуживания в случае, если смерть наступила в период пребывания лица в данной организации.Должностное лицо учреждения, исполняющего наказание, в случае, если смерть осужденного наступила в период отбывания им наказания в местах лишения свободы.Должностное лицо органа дознания или следствия в случае, если проводится расследование в связи со смертью лица либо по факту смерти, когда личность умершего не установлена.Командир воинской части в случае, если смерть наступила в период прохождения лицом военной службы.Вместо указанных выше лиц подать заявление могут их официальные представители. Услугу окажут в течение 2 рабочих дней. Заявитель получит свидетельство о смерти по форме или извещения об отказе в государственной регистрации акта гражданского состояния по форме. Воспользуйтесь поиском, чтобы узнать, в каком из ближайших центров можно получить
                                    эту услугу. Эта услуга предоставляется на федеральном порталеgosuslugi.ru, куда вы будете перенаправлены при нажатии кнопки «Получить услугу».При возникновении проблем или вопросов рекомендуем обращаться в службу технической поддержки федерального портала по телефону 8 800 100-70-10 (короткий номер для мобильных телефонов — 115)."
Государственная регистрация установления отцовства,https://gu.spb.ru/187861/,"Существует несколько оснований установления отцовства. Совместное заявлениеЕсли родители ребенка подают совместное заявление в органы ЗАГС, то отцовство устанавливается при регистрации малыша или после его рождения.Если регистрация отцовства происходит в отношении совершеннолетнего, понадобится его письменное согласие. Заявление отца ребенкаОтец вправе подать заявление сам, если:мать ребенка умерла;неизвестно место ее пребывания;она признана недееспособной;ее лишили родительских прав. Решение судаОтцовство можно установить в судебном порядке. Происхождение ребенка от конкретного лица (отцовство) устанавливается в судебном порядке по заявлению одного из родителей, опекуна (попечителя) ребенка или по заявлению лица, на иждивении которого находится ребенок, а также по заявлению самого ребенка по достижении им совершеннолетия. Заявление могут подать следующие лица: один из родителей; опекун (попечитель) ребенка; лицо, на иждивении  которого находится ребенок; само лицо, в отношении которого устанавливается отцовство по достижении им совершеннолетия; представитель учреждения социальной защиты населения.Вместо указанных выше лиц подать заявление могут их официальные представители. Услугу окажут в день обращения или в течение трех рабочих дней (в случае обращения в МФЦ). Заявитель получит свидетельство об установлении отцовства, о рождении (в случае установления отцовства после рождения ребенка) либо извещение об отказе в государственной регистрации акта гражданского состояния. Воспользуйтесь поиском, чтобы узнать, в каком из ближайших центров можно получить
                                    эту услугу. Примените фильтр, чтобы увидеть сроки и документы для вашей ситуации Государственная регистрация установления отцовства возможна в случае обращения с совместным заявлением об установлении отцовства отца и матери ребенка, не состоящих между собой в браке на момент рождения ребенка. Государственная регистрация установления отцовства возможна на основании решения суда. При установлении отцовства с участием иностранного гражданина документы, выданные компетентными органами иностранного государства и предъявленные для государственной регистрации установления отцовства, должны быть легализованы, если иное не предусмотрено международными договорами Российской Федерации, и переведены на государственный язык Российской Федерации (русский язык). Верность перевода должна быть нотариально удостоверена. Государственная регистрация установления отцовства в Санкт‑Петербурге производится органом записи актов гражданского состояния в случаях, если:местом жительства отца или матери ребенка, не состоящих между собой в браке на момент рождения ребенка, является Санкт‑Петербург;местом государственной регистрации рождения ребенка является орган записи актов гражданского состояния Санкт‑Петербурга;имеется решение суда об установлении отцовства или об установлении факта признания отцовства, вынесенное на территории Санкт‑Петербурга. Эта услуга предоставляется на федеральном порталеgosuslugi.ru, куда вы будете перенаправлены при нажатии кнопки «Получить услугу».При возникновении проблем или вопросов рекомендуем обращаться в службу технической поддержки федерального портала по телефону 8 800 100-70-10 (короткий номер для мобильных телефонов — 115)."
Государственная регистрация усыновления (удочерения),https://gu.spb.ru/187849/,"Если вы усыновили или удочерили ребенка, необходимо оформить свидетельство о государственной регистрации усыновления (удочерения). Для этого нужно обратиться в отдел ЗАГС по месту жительства или по месту вынесения решения суда и подать заявление.При подаче заявления на Едином портале прикладывать скан-образы документов не надо, их надо представить в орган ЗАГС. Подать заявление могут следующие лица:Граждане Российской Федерации.Иностранные граждане.Лица без гражданства.Являющиеся усыновителями (одним из усыновителей) ребенка, в случаях:если решение суда об установлении усыновления ребенка, вступившее в законную силу, вынесено судом Санкт‑Петербурга;если усыновители (один из усыновителей) имеет регистрацию по месту жительства в Санкт‑Петербурге.Вместо указанных лиц, подать заявление могут их официальные представители. Услугу окажут в течение 3 рабочих дней. Составление в Едином государственном реестре записей актов гражданского состояния (ЕГР ЗАГС) соответствующей записи акта гражданского состояния и выдача заявителю свидетельства об усыновлении (удочерении) по форме либо извещения об отказе в государственной регистрации акта гражданского состояния по форме. Воспользуйтесь поиском, чтобы узнать, в каком из ближайших центров можно получить
                                    эту услугу. В соответствии с п. 2 ст. 124Семейного кодекса РоссийскойФедерацииусыновление допускается в отношении несовершеннолетних детей. Согласие усыновляемого требуется, если на момент усыновления ему исполнилось 10 лет. На основании записи акта об усыновлении орган записи актов гражданского состояния (по месту хранения записи акта о рождении ребенка на бумажном носителе) вносит соответствующие изменения в запись акта о рождении ребёнка.В случае изменения на основании решения суда об усыновлении ребёнка даты и (или) места рождения ребёнка орган записи актов гражданского состояния по выбору усыновителей (усыновителя) составляет новую запись акта о рождении ребёнка. Сведения о составлении новой записи акта о рождении ребёнка вносятся в ранее произведённую запись акта о его рождении.Орган записи актов гражданского состояния по месту государственной регистрации усыновления ребёнка выдаёт новое свидетельство о его рождении на основании изменённой или вновь составленной в связи с усыновлением записи акта о рождении ребёнка. Ранее выданное свидетельство о рождении (при наличии) изымается и уничтожается. Поменять имя можно с помощью государственной регистрации перемены имени (для лиц, достигших возраста 14 лет) либо на основании решения органа опеки и попечительства о согласии на изменение фамилии и (или) собственно имени ребёнка, выданном в соответствиисо статьей 59 Семейного кодекса Российской Федерации(для лиц, не достигших возраста 14 лет).Порядок государственной регистрации перемены имени регламентированстатьями 58-63 Федерального закона «Об актах гражданского состояния». В соответствии с указанными статьями лицо, достигшее возраста четырнадцати лет, вправе переменить фамилию, имя и (или) отчество.Заявление о перемене имени подаётся в орган ЗАГС в письменной форме лично лицом, желающим переменить имя. При себе необходимо иметь паспорт.Одновременно с подачей такого заявления нужно представить следующие документы:свидетельство о рождении лица, желающего переменить имя;свидетельство о заключении брака в случае, если заявитель состоит в браке;свидетельство о расторжении брака в случае, если заявитель ходатайствует о присвоении ему добрачной фамилии в связи с расторжением брака;свидетельство о рождении каждого из детей заявителя, не достигших совершеннолетия.Орган ЗАГС рассматривает заявление о перемене имени в течение месяца со дня подачи документа. При наличии уважительных причин руководитель органа ЗАГС может увеличить срок рассмотрения заявления, но не более чем на два месяца.На основании записи акта о перемене имени вносятся изменения в записи актов гражданского состояния, ранее составленные в отношении лица, переменившего имя, и выдаются новые свидетельства о государственной регистрации актов гражданского состояния с учетом внесённых в записи актов гражданского состояния изменений.В соответствиисо статьей 333.26 Налогового кодекса Российской Федерацииза государственную регистрацию перемены имени и выдачу свидетельства о перемене имени нужно уплатить государственную пошлину — 1600 руб., за выдачу нового свидетельства о государственной регистрации акта гражданского состояния — 350 руб. (за каждый документ). Эта услуга предоставляется на федеральном порталеgosuslugi.ru, куда вы будете перенаправлены при нажатии кнопки «Получить услугу».При возникновении проблем или вопросов рекомендуем обращаться в службу технической поддержки федерального портала по телефону 8 800 100-70-10 (короткий номер для мобильных телефонов — 115)."
