title,link,content
Приём уведомлений о планируемом сносе объектов капитального строительства,https://gu.spb.ru/642937/,"Застройщики или технические заказчики, уполномоченные застройщиком, при принятии решения о сносе объекта капитального строительства должны подать соответствующее уведомление вСлужбу государственного строительного надзора и экспертизы Санкт-Петербурга.Застройщик должен быть правообладателем объекта капитального строительства, а также земельного участка.Уведомление нужно податьне позднее 7 рабочих дней перед началом работ по сносуобъекта капитального строительства.Государственная пошлина либо иная плата за предоставление государственной услуги не взимается. Уведомление нужно податьне позднее 7 рабочих дней перед началом работ по сносуобъекта капитального строительства. Государственная пошлина либо иная плата за предоставление государственной услуги не взимается. Подать заявление могут:застройщики (физические лица, индивидуальные предприниматели, юридические лица, независимо от организационно-правовой формы) — правообладатели земельных участков, объектов капитального строительства, принявшие решение о сносе объекта капитального строительства;технические заказчики, уполномоченные застройщиками на подготовку проектной документации о сносе объекта капитального строительства.Вместо указанных выше лиц подать заявление могут их официальные представители. Услугу окажут в течение7 рабочих днейс даты поступления уведомления о планируемом сносе объекта капитального строительства (уведомление о планируемом сносе) и обязательных к представлению документов в Службу. В случае принятияположительного решениязаявитель получит уведомление и документы, предусмотренныеположениями ч.10 ст. 55.31 Градостроительного кодекса Российской Федерации.Информация будет направлена в Комитет по градостроительству и архитектуре для размещения в государственной информационной системе Санкт-Петербурга «Автоматизированная информационная система управления градостроительной деятельностью» (АИС УГД).При принятииотрицательного решениязаявитель получит уведомление об отказе. Информация будет направлена в Комитет по градостроительству и архитектуре для размещения в государственной информационной системе Санкт-Петербурга «Автоматизированная информационная система управления градостроительной деятельностью» (АИС УГД). Воспользуйтесь поиском, чтобы узнать, в каком из ближайших центров можно получить
                                    эту услугу. Застройщик —  это физическое или юридическое лицо, обеспечивающее на принадлежащем ему земельном участке или на земельном участке иного правообладателя (которому при осуществлении бюджетных инвестиций в объекты капитального строительства государственной (муниципальной) собственности органы государственной власти (государственные органы), Государственная корпорация по атомной энергии «Росатом», Государственная корпорация по космической деятельности «Роскосмос», органы управления государственными внебюджетными фондами или органы местного самоуправления передали в случаях, установленных бюджетным законодательством Российской Федерации, на основании соглашений свои полномочия государственного (муниципального) заказчика или которому в соответствии со статьей 13.3Федерального закона от 29.07.2017 №218-ФЗ «О публично-правовой компании по защите прав граждан —  участников долевого строительства при несостоятельности (банкротстве) застройщиков и о внесении изменений в отдельные законодательные акты Российской Федерации»передали на основании соглашений свои функции застройщика) строительство, реконструкцию объектов капитального строительства. Отправлять уведомление вСлужбу государственного строительного надзора и экспертизы Санкт-Петербургане нужно.В этом случае необходимо обратиться вУправление Росреестра по Санкт-Петербургус документом, подтверждающим утрату объекта капитального строительства. Да, при направлении уведомления о планируемом сносе необходимо указывать всех собственников жилого дома. Уведомление должно быть подписано всеми собственниками, которые указаны в документах собственности. Нет, отправление уведомления о планируемом сносе по электронной почте недопустимо.Уведомление о планируемом сносе жилого дома может быть направлено следующими способами:по почте или лично по адресу: 191023, Санкт-Петербург, ул. Зодчего Росси, д. 1-3;через МФЦ;через региональный портал госуслуг на страницеуслуги. Если собственником жилого дома, подлежащего сносу, является несовершеннолетний гражданин, потребуется разрешение органа опеки и попечительства в целях соблюдения прав ребёнка. Историческое здание – здание, строение, сооружение, не являющееся объектом (выявленным объектом) культурного наследия, относящееся к следующим историческим периодам:в зонах охраны объектов культурного наследия, расположенных в исторически сложившихся центральных районах Санкт Петербурга, а также в Невском районе Санкт Петербурга, – построенное до 1917 года;в зонах охраны объектов культурного наследия, расположенных за пределами исторически сложившихся центральных районов Санкт Петербурга (за исключением Невского района Санкт Петербурга), – построенное до 1957 года, деревянное 1-2-этажное здание, строение, сооружение – построенное до 1917 года (год постройки определяется в соответствии с учетно-технической документацией об объектах государственного технического учета и технической инвентаризации). К сносу запрещены исторические здания, объекты, имеющие статус объектов культурного наследия.Вопросы в отношении подобных объектов находятся в компетенцииКомитета по государственному контролю, использованию и охране памятников истории и культуры. Уведомление о планируемом сносе жилого дома может подать его собственник (собственники) либо доверенное лицо. Перед подачей уведомления о планируемом сносе жилого дома необходимо проверить объект на наличие установленных в отношении него ограничений прав или обременений вЕдином государственном реестре недвижимости. Ответы на популярные вопросы о порядке сноса объектов капитального строительства в Санкт-Петербурге можно узнать вчат-боте. Приём уведомлений о завершении сноса объектов капитального строительства"
Приём экзаменов на право управления самоходными машинами и выдача удостоверений тракториста-машиниста,https://gu.spb.ru/188813/,"Для подтверждения своего права на управление самоходными машинами необходимо получить удостоверение тракториста‑машиниста (тракториста) или временное удостоверение на право управления самоходными машинами.Удостоверение тракториста‑машиниста (тракториста) выдается после сдачи вГосударственной технической инспекции Санкт‑Петербургаэкзамена на право управления самоходными машинами.Замена удостоверения осуществляется в следующих случаях:по истечении срока (через 10 лет);утраты (хищения);пришедшего в негодность для дальнейшего использования вследствие износа, повреждения или других причин, если сведения, указанные в нем (либо в его части) невозможно определить визуально, возврат удостоверения лицу, подвергнутому административному наказанию в виде лишения права управления транспортным средством за совершение административных правонарушений, а также в связи с изменением фамилии, имени или отчества. Заявление могут подать граждане Российской Федерации и иностранные граждане, обратившиеся вГостехнадзор Санкт‑Петербурга:за получением впервые или возвратом ранее изъятого удостоверения тракториста‑машиниста (тракториста);за заменой ранее выданного удостоверения тракториста‑машиниста (тракториста) (других удостоверений на право управления самоходными машинами);в случае направления указанных лиц образовательными учреждениями — для прохождения производственной практики на срок до 2‑ух месяцев, за получением временного удостоверения на право управления самоходными машинами.Вместо перечисленных выше лиц заявление могут подать представители – физические и юридические лица, действующие на основании подтверждающих документов. Услугу окажут в течение 11 рабочих дней со дня подачи заявления. Документ, являющийся результатом предоставления государственной услуги, будет выдан в течение 15 минут с момента готовности. В случае успешной сдачи экзаменов заявитель получит удостоверение (временное удостоверение) тракториста-машиниста. В случае отказа заявитель получит уведомление в допуске к экзаменам или выдаче удостоверения. Воспользуйтесь поиском, чтобы узнать, в каком из ближайших центров можно получить
                                    эту услугу. Организации, осуществляющие образовательную деятельность, имеющие лицензию на ведение образовательной деятельности по подготовке машинистов самоходных машин в Санкт-Петербурге, см.здесь. К сдаче экзаменов на право управления самоходными машинами допускаются лица достигшие возраста:16 лет — для самоходных машин категории «А I»;17 лет — для самоходных машин категорий «В», «С», «Е», «F»;18 лет — для самоходных машин категории «D»;19 лет — для самоходных машин категорий «А II», «А III»;22 лет — для самоходных машин категории «А IV». Медицинскую справку о допуске к управлению самоходными машинами необходимо предоставить:для сдачи экзаменов на право управления самоходными машинами соответствующей категории;для возврата удостоверения тракториста-машиниста (тракториста) лицу, лишенному права управления транспортными средствами за совершение административных правонарушений, предусмотренных частями 1 и 4 статьи 12.8, частью 1 статьи 12.26 и частью 3 статьи 12.27Кодекса Российской Федерации об административных правонарушениях;для выдачи удостоверения тракториста-машиниста (тракториста) в связи с утратой (хищением) удостоверения тракториста-машиниста (тракториста);для замены удостоверения тракториста-машиниста (тракториста) пришедшего в негодность для дальнейшего использования вследствие износа, повреждения или других причин, если сведения, указанные в нем (либо в его части) невозможно определить визуально, а также удостоверения тракториста-машиниста (тракториста) в связи с изменением фамилии, имени или отчества;для возврата (выдачи) удостоверения тракториста-машиниста (тракториста) после установления полного или частичного отсутствия медицинских противопоказаний к управлению самоходными машинами, послуживших основанием прекращения действия права на управление транспортными средствами.Документ приобщается к бумажному пакету документов в оригинале и возвращается заявителю (представителю) вместе с результатом предоставления государственной услуги. Выдача и замена водительских удостоверений"
"Приём, рассмотрение заявлений (уведомления) застрахованных лиц в целях реализации ими прав при формировании и инвестировании средств пенсионных накоплений и принятию решений по ним",https://gu.spb.ru/187873/,"Если вы застрахованы в системе обязательного пенсионного страхования (ОПС) и не обращались за установлением накопительной пенсии, можете выбрать, куда будут переведены ваши пенсионные накопления:в негосударственный пенсионный фонд (НПФ) из Социального фонда России (СФР);в СФР из НПФ;из одного НПФ в другой НПФ.В рамках услуги вы можете подать заявление о выборе инвестиционного портфеля. Обратите внимание, с 01.01.2019 многофункциональные центры (МФЦ) не принимают заявления о переходе в НПФ или о переходе в СФР из НПФ (в том числе досрочном). Заявление могут подать граждане Российской Федерации, постоянно проживающие на территории Российской Федерации иностранные граждане или лица без гражданства – застрахованные лица, на которых распространяется обязательное пенсионное страхование в соответствии со статьей 7 Федерального закона от 15.12.2001 №167‑ФЗ «Об обязательном пенсионном страховании в Российской Федерации», не обратившиеся за установлением накопительной пенсии, срочной пенсионной выплаты, единовременной выплаты средств пенсионных накоплений.Вместо указанных выше лиц подать заявление могут их представители, действующие на основании подтверждающих документов. Государственная услуга предоставляется в течение 1 дня.Заявление о выборе УК рассматривается СФР с принятием решения об удовлетворении (с внесением изменений в специальную часть индивидуального лицевого счета застрахованного лица) или отказе в удовлетворении заявления либо оставлении его без рассмотрения в срок до 1 марта года, следующего за годом подачи застрахованным лицом заявления о выборе УК. Будет принято решение об удовлетворении заявления с внесением изменений в специальную часть индивидуального лицевого счета застрахованного лица в системе ОПС либо решение об отказе в удовлетворении заявления. Воспользуйтесь поиском, чтобы узнать, в каком из ближайших центров можно получить
                                    эту услугу."
