title,link,content
"Выдача удостоверения о праве на меры социальной поддержки вдовам, нетрудоспособным членам семьи погибшего",https://gu.spb.ru/188047/,"Члены семьи умершего (погибшего) участника Великой Отечественной войны, инвалида войны или ветерана боевых действий могут оформить соответствующее удостоверение и получать различные меры социальной поддержки (например,путевки в санаторийза счет федерального бюджета). Заявление могут подать члены семьи погибшего (умершего) инвалида войны, участника Великой Отечественной войны и ветерана боевых действий (см.полный перечень лиц, имеющих право на получение государственной услуги).Вместо перечисленных выше лиц подать заявление могут их представители. Администрация примет решение о выдаче (отказе в выдаче) удостоверений или их дубликатов в течение 10 рабочих дней с даты приема заявления со всеми необходимыми документами. Заявитель получит копию распоряжения (выписку из распоряжения) с решением Администрации о выдаче удостоверения (дубликата) или отказе в выдаче. В случае положительного решения заявитель получит удостоверение (его дубликат). Воспользуйтесь поиском, чтобы узнать, в каком из ближайших центров можно получить
                                    эту услугу. Нетрудоспособные члены семьи, состоявшие на иждивении погибшего (умершего), могут претендовать на следующие льготы (согласност. 21 Федерального закона от 12.01.1995 №5-ФЗ «О ветеранах»):льготы по пенсионному обеспечению;преимущество при вступлении в жилищные, жилищно-строительные и гаражные кооперативы;первоочередное право на приобретение земельных участков;обеспечение жильём нуждающихся за счет средств федерального бюджета, за исключением членов семей погибших (умерших) инвалидов и участников ВОВ, которым предоставляется жилье вне зависимости от имущественного положения;получение медицинской помощи в медицинских организациях, к которым льготник был прикреплён при жизни погибшего (умершего);компенсация расходов на оплату жилых помещений и коммунальных услуг в размере 50%;первоочередной приём в организации социального обслуживания. Помимо нетрудоспособных членов семьи, состоявших на иждивении погибших (умерших) инвалидов войны, участников ВОВ, ветеранов боевых действий, на меры социальной поддержки могут претендовать (согласност. 21 Федерального закона от 12.01.1995 №5-ФЗ «О ветеранах»):родители погибшего (умершего);супруга (супруг) погибшего (умершего), не вступившая в повторный брак. Следует обращаться в ОСЗН Администрации по месту жительства."
Выдача удостоверения участникам катастрофы на Чернобыльской АЭС,https://gu.spb.ru/188039/,"Пострадавшие от радиационного воздействия, полученного вследствие аварии на Чернобыльской АЭС, могут оформить специальное удостоверение для полученияразличных мер социальной поддержки. Подать заявление могут граждане Российской Федерации из числа:эвакуированных (в том числе выехавших добровольно) в 1986 году из зоны отчуждения или переселенных (переселяемых), в том числе выехавших добровольно, из зоны отселения в 1986 году и в последующие годы, включая детей, в том числе детей, которые в момент эвакуации находились (находятся) в состоянии внутриутробного развития;выехавших добровольно на новое место жительства из зоны проживания с правом на отселение в 1986 году и в последующие годы;военнослужащих, лиц начальствующего и рядового состава органов внутренних дел, Государственной противопожарной службы, проходящих (проходивших) военную службу (службу) в зоне отчуждения, зоне отселения, зоне проживания с правом на отселение.Вместо перечисленных выше лиц подать заявление могут их официальные представители, действующие на основании доверенности, а также их опекуны и попечители. Услуга будет оказана в течение30 днейс момента подачи заявления. При положительном решенииадминистрации районазаявитель получит соответствующее уведомление о выдаче удостоверения (дубликата удостоверения) и само удостоверение (дубликат удостоверения). Если решение будет отрицательным, то заявитель получит уведомление об отказе в выдаче удостоверения (дубликата удостоверения) с указанием причины отказа и порядка его обжалования. Воспользуйтесь поиском, чтобы узнать, в каком из ближайших центров можно получить
                                    эту услугу. Для каждой категории граждан, указанных в ст. 13Закона Российской Федерации от 15.05.1991 №1244-1 «О социальной защите граждан, подвергшихся воздействию радиации вследствие катастрофы на Чернобыльской АЭС», предусмотрены свои отдельные меры социальной поддержки.В Санкт-Петербурге (за счет средств бюджета Санкт-Петербурга) гражданам, пострадавшим вследствие радиационных воздействий, предоставляются меры социальной поддержки по льготному проезду, предоставлению дачных помещений, бесплатному зубопротезированию и др. Для каждой категории граждан, указанных в ст. 13Закона Российской Федерации от 15.05.1991 №1244-1 «О социальной защите граждан, подвергшихся воздействию радиации вследствие катастрофы на Чернобыльской АЭС», предусмотрены свои отдельные меры социальной поддержки.В Санкт-Петербурге (за счет средств бюджета Санкт-Петербурга) гражданам, пострадавшим вследствие радиационных воздействий, предоставляются меры социальной поддержки по льготному проезду, предоставлению дачных помещений, бесплатному зубопротезированию и др. В случае утраты удостоверения гражданину необходимо обратиться за получением дубликата удостоверения, представив при этом справку из органов внутренних дел, подтверждающую, что утраченное удостоверение не найдено. В данном случае заявитель может доказать своё право на получение удостоверения в судебном порядке. Выдача удостоверения участника ликвидации аварии на Чернобыльской АЭСВыдача удостоверения инвалидам Чернобыльской АЭСОплата дополнительного отпуска гражданам, подвергшимся воздействию радиации вследствие катастрофы на Чернобыльской АЭССохранение среднего заработка гражданам, эвакуированным и переселенным (переселяемым), а также выехавшим в добровольном порядке с территории отдельных зон радиоактивного загрязнения вследствие катастрофы на Чернобыльской АЭСЕжемесячная денежная компенсация на возмещение вреда, причиненного здоровью в связи с радиационным воздействием вследствие чернобыльской катастрофы (без установления инвалидности)Пособие на погребение членам семей граждан, пострадавших в результате катастрофы на Чернобыльской АЭСЕжемесячная денежная компенсация на приобретение продовольственных товаров гражданам, подвергшимся воздействию радиации вследствие катастрофы на Чернобыльской АЭСКомпенсация за вред, нанесенный здоровью вследствие чернобыльской катастрофы, компенсация на оздоровление и компенсации семьям за потерю кормильцаЕжемесячная денежная компенсация в возмещение вреда, причиненного здоровью в связи с радиационным воздействием вследствие чернобыльской катастрофы"
Государственная регистрация рождения,https://gu.spb.ru/187841/,"После рождения ребенка необходимо получить свидетельство о его рождении. Это первый и главный документ малыша. Оформить его лучше в течение месяца, так как он позволит получить пособия, а также материнский капитал, СНИЛС и полис ОМС.В нем потребуется указать имя, отчество и фамилию ребенка.Свидетельство о рождении выдает отдел ЗАГС по месту рождения ребенка или по месту жительства родителей (одного из родителей). ​После его получения можно будет зарегистрировать ребенка по месту жительства.Если вы хотите отпраздновать рождение ребенка в торжественной обстановке, зарегистрировать малыша можново Дворце «Малютка». Подать заявление могут следующие лица:родители (один из родителей);официальный представитель родителей (родителя) на основании доверенности;должностное лицо медицинской организации или иной организации, в которой находилась мать во время родов или находится ребенок;должностное лицо органов внутренних дел, органов опеки и попечительства либо медицинских организаций, воспитательных организаций или организаций социального обслуживания, в которую помещен найденный (подкинутый) ребенок, родители которого неизвестны;руководителю медицинской организации, в которой происходили роды или врач которой установил факт рождения мертвого ребенка;индивидуальный предприниматель, осуществляющий медицинскую деятельность, установивший и факт рождения мертвого ребенка (при родах вне медицинской организации);представитель медицинской организации, в которой происходили роды или в которую обратилась мать после родов, либо органа опеки и попечительства по месту нахождения ребенка — в случае государственной регистрации рождения ребенка, оставленного матерью, не предъявившей документ, удостоверяющий ее личность.В МФЦ не рассматриваются случаи регистрации рождения на основании заявлений иностранных граждан, лиц без гражданства или лиц, гражданство которых не определено. Данные категории заявителей обращаются за государственной регистрацией рождения непосредственно в структурные подразделения Комитета по делам записи актов гражданского состояния. Услугу окажут в течение 3 рабочих дней. Заявитель получит свидетельство о рождении либо извещение об отказе в государственной регистрации акта гражданского состояния по форме.Если ребенок родился в Санкт-Петербурге, ему выдается памятный знак «Родившемуся в Санкт‑Петербурге». Воспользуйтесь поиском, чтобы узнать, в каком из ближайших центров можно получить
                                    эту услугу. Примените фильтр, чтобы увидеть сроки и документы для вашей ситуации В соответствии со статьей 15Федерального законагосударственная регистрация рождения производится органом записи актов гражданского состояния по месту рождения ребенка или по месту жительства родителей (одного из родителей). В Санкт‑Петербурге государственная регистрация рождения в торжественной обстановке осуществляется отделом регистрации актов гражданского состояния о рождении — дворцом «Малютка» (далее — дворец «Малютка»).Торжественная обстановка включает предметы внутреннего убранства и интерьеров помещений дворца «Малютка», поздравительную речь ведущего церемонии имянаречения, музыкальное сопровождение В соответствии с пунктом 3 статьи 15Федерального законав случае если ребенок родился на судне, в самолете, в поезде или в другом транспортном средстве во время его следования, государственная регистрация рождения производится органом записи актов гражданского состояния по месту жительства родителей (одного из родителей) или любым органом записи актов гражданского состояния, расположенным по маршруту следования транспортного средства.Местом рождения ребенка указывается место государственной регистрации рождения ребенка. Согласно пункту 1 статьи 15Федерального законагосударственная регистрация рождения производится органом записи актов гражданского состояния по месту рождения ребенка или по месту жительства родителей (одного из родителей).Таким образом, родители вправе зарегистрировать рождение ребенка в органе записи актов гражданского состояния города, в котором родился ребенок, либо в органе записи актов гражданского состояния Санкт‑Петербурга по месту жительства родителей.Местом рождения ребенка будет указано фактические место его рождения — наименование города, в котором родился ребенок Единовременная компенсационная выплата при рождении ребенкаЕдиновременное пособие при рождении ребёнкаЕжемесячное пособие на ребёнка в возрасте от рождения до 1,5 лет Эта услуга предоставляется на федеральном порталеgosuslugi.ru, куда вы будете перенаправлены при нажатии кнопки «Получить услугу».При возникновении проблем или вопросов рекомендуем обращаться в службу технической поддержки федерального портала по телефону 8 800 100-70-10 (короткий номер для мобильных телефонов — 115)."
