title,link,content
Прием заявок в рамках «догазификации» в МФЦ,https://gu.spb.ru/652195/,"Чтобы подключить газ к своемудомовладению, нужно подать заявление в любом удобном МФЦ, за исключением центров для бизнеса. Это возможно, если:Объект индивидуального жилищного строительства или жилой дом блокированной застройки и примыкающие к ним и (или) отдельно стоящие на общем с объектом индивидуального жилищного строительства или жилым домом блокированной застройки земельном участке надворные постройки (гараж, баня (сауна, бассейн), теплица (зимний сад), помещения для содержания домашнего скота и птицы, иные объекты)Закрытьдомовладение принадлежит на праве собственности или на ином предусмотренном законом праве;газ будет использоваться для удовлетворения личных, семейных домашних и иных нужд, не связанных с осуществлением предпринимательской (профессиональной) деятельности.Догазификация проводится в населённых пунктах, в которых уже проложены газораспределительные сети. Она распространяется на бесплатное подключение к газу принадлежащих гражданам индивидуальных жилых домов. Газопроводы строят до границ земельных участков, на которых расположены такие дома. Если жилой дом расположен в границах СНТ, а СНТ – в границах населенного пункта, бесплатно может быть подведен газопровод только до границы такого СНТ.
Воспользоваться правом на бесплатную газификацию можно не чаще, чем один раз в три года. Физическое лицо, намеренное осуществить подключение (технологическое присоединение), в том числе фактическое присоединение к газораспределительным сетям газоиспользующего оборудования, расположенного в домовладениях, принадлежащих физическим лицам на праве собственности или на ином предусмотренном законом праве в целях использования газа для удовлетворения личных, семейных домашних и иных нужд, не связанных с осуществлением предпринимательской (профессиональной) деятельности. Земельный участок должен находиться исключительно на территории Санкт-Петербурга. Срок предоставления услуги в течение 3 рабочих дней со дня получения заявки, документов и сведений к ней в полном объеме. Уведомление о принятии заявки в работу.Уведомление о необходимости представить недостающие документы и (или) сведения.Уведомление об аннулировании заявки.Уведомление о невозможности заключения договора. Воспользуйтесь поиском, чтобы узнать, в каком из ближайших центров можно получить
                                    эту услугу. В случае если территория садоводства располагается в границах населенного пункта, в котором проложены газораспределительные сети, по которым осуществляется транспортировка газа, или программой газификации жилищно-коммунального хозяйства, промышленных и иных организаций в текущем календарном году предусмотрено строительство газораспределительных сетей до границ такой территории, то подключение к сетям газораспределения домовладений, расположенных внутри границ территории садоводства, осуществляется исполнителем до границ земельных участков, принадлежащих указанным физическим лицам, на которых расположены такие домовладения, без взимания средств с заявителя за оказание услуги по подключению (технологическому присоединению) при условии возможности строительства сети газораспределения и (или) сети газопотребления внутри границ территории садоводства. Заключение договора поставки газаПередача информации поставщику газа об изменениях, произошедших по адресу жилого помещения"
Приём заявок на предоставление лицензий на право использовать компьютерное программное обеспечение,https://gu.spb.ru/598737/,"Чтобы использовать компьютерное программное обеспечение (ПО), разрабатываемоеАкционерным обществом «Производственная фирма «СКБ Контур»(АО «ПФ «СКБ
		Контур»), вам нужно получить лицензию.Лицензия дает право использовать программный продукт в сферах:Шаг1Учет и отчетность:Отчетность в контролирующие органы. Подготовка и отправка всей необходимой отчетности во все контролирующие органы (ФНС, ПФР, ФСС, Росстат, РАР, РПН). Оповещения о статусе отчетов и требованиях ФНС.
						Работа с электронными больничными, подготовка документов для уплаты налогов;Онлайн‑бухгалтерия. Ведение бизнеса и бухгалтерии на ОСНО, УСН и ЕНВД. Ведение бухгалтерского и налогового учета. Ведение, учет и расчет заработной платы, больничных и отпускных.Шаг2Онлайн‑кассы:Оператор фискальных данных. Мгновенная отправка фискальных данных в ФНС, поиск любого чека за весь период работы, данные по наличным и безналичным расчетам быстрее, чем в интернет‑банке, возможность
						сверки данных о продажах и деньгах с данными в своей учетной системе;Кассовое программное обеспечение. Заполнение каталога товаров и услуг, автоматический учет товаров, создание ценников и штрихкодов, для сферы услуг — онлайн‑запись клиентов, календарь, рабочий
						график, для общепита — техкарты блюд, учет продуктов, заказы по столикам и гостям. Все виды расчета на кассе (наличные, по карте, предоплата, авансы, смешанная оплата, скидки). Наглядные отчеты для анализа продаж и
						др.Шаг3Работа с контрагентами:Сервис поиска Закупок. Поиск государственных и коммерческих закупок по Федеральным законамот 05.04.2013 №44‑ФЗиот 13.07.2015 №223‑ФЗ. Помощь в работе с закупками, наблюдение за их изменениями, анализ заказчиков и поставщиков;Проверка контрагентов на благонадежность. Информация о банкротстве, арбитражных делах и долгах из официальных источников. Подбор клиентов и поставщиков;Электронный документооборот. Обмен с контрагентами электронными юридически значимыми документами без дублирования на бумажном носителе, хранение документов на защищенных серверах. Учет и отчетность:Отчетность в контролирующие органы. Подготовка и отправка всей необходимой отчетности во все контролирующие органы (ФНС, ПФР, ФСС, Росстат, РАР, РПН). Оповещения о статусе отчетов и требованиях ФНС.
						Работа с электронными больничными, подготовка документов для уплаты налогов;Онлайн‑бухгалтерия. Ведение бизнеса и бухгалтерии на ОСНО, УСН и ЕНВД. Ведение бухгалтерского и налогового учета. Ведение, учет и расчет заработной платы, больничных и отпускных. Онлайн‑кассы:Оператор фискальных данных. Мгновенная отправка фискальных данных в ФНС, поиск любого чека за весь период работы, данные по наличным и безналичным расчетам быстрее, чем в интернет‑банке, возможность
						сверки данных о продажах и деньгах с данными в своей учетной системе;Кассовое программное обеспечение. Заполнение каталога товаров и услуг, автоматический учет товаров, создание ценников и штрихкодов, для сферы услуг — онлайн‑запись клиентов, календарь, рабочий
						график, для общепита — техкарты блюд, учет продуктов, заказы по столикам и гостям. Все виды расчета на кассе (наличные, по карте, предоплата, авансы, смешанная оплата, скидки). Наглядные отчеты для анализа продаж и
						др. Работа с контрагентами:Сервис поиска Закупок. Поиск государственных и коммерческих закупок по Федеральным законамот 05.04.2013 №44‑ФЗиот 13.07.2015 №223‑ФЗ. Помощь в работе с закупками, наблюдение за их изменениями, анализ заказчиков и поставщиков;Проверка контрагентов на благонадежность. Информация о банкротстве, арбитражных делах и долгах из официальных источников. Подбор клиентов и поставщиков;Электронный документооборот. Обмен с контрагентами электронными юридически значимыми документами без дублирования на бумажном носителе, хранение документов на защищенных серверах. Подать заявление могут:юридические лица;индивидуальные предприниматели;граждане, планирующие начать предпринимательскую деятельность (физические лица). Услуга будет оказана течение 1 рабочего дня (результат услуги выдается сразу после оформления обращения). Заявитель получит памятку о дальнейших действиях.После приема заявки на предоставление лицензий на право использовать ПО поставщик программного обеспечения самостоятельно связывается с заявителем и информирует о дальнейших действиях (заключение договора, выставление счета, предоставление необходимых документов поставщику программного обеспечения, удостоверение личности и т.д.). Воспользуйтесь поиском, чтобы узнать, в каком из ближайших центров можно получить
                                    эту услугу."
Приём заявок на создание и выдачу квалифицированного сертификата ключа проверки электронной подписи,https://gu.spb.ru/587995/,"Информация в электронной форме, подписанная квалифицированной электронной подписью (КЭП), признается электронным документом, равнозначным документу на бумажном носителе, подписанному собственноручной подписью, и может применяться в любых правоотношениях в соответствии с законодательством РФ, кроме случая, если федеральными законами или принимаемыми в соответствии с ними нормативными правовыми актами установлено требование о необходимости составления документа исключительно на бумажном носителе, данные о том, что исполнитель услуги: ООО «Сертум-Про».Область применения КЭП:Шаг1Подача электронных документов в государственные органы (в налоговые органы, в службу судебных приставов, в таможенные органы и др.).Шаг2Работа в электронной системе ЕГАИС.Шаг3Получение государственных и муниципальных услуг в электронном виде.Шаг4Подписание электронных счетов‑фактур.Шаг5Участие в электронных торгах (государственные торги поФедеральному закону РФ от 05.04.2013 №44‑ФЗиФедеральному закону РФ от 18.07.2011 №223‑ФЗ, коммерческие торги, торги по банкротству и др.).Шаг6Внесение сведений в государственные базы данных (в Единый федеральный реестр сведений о фактах деятельности юридических лиц и др.).Шаг7И другое.В состав КЭП входит:квалифицированный сертификат ключа проверки электронной подписи (электронный документ, который содержит: сведения о владельце, открытый ключ для проверки подлинности подписи получателем; и т.д.);программное обеспечение (средство электронной подписи — набор криптографических алгоритмов и функций, без которых подписание документов электронной подписью невозможно);носитель (место, куда устанавливается электронная подпись: в память компьютера (в реестр или на жесткий диск), токен или флеш‑носитель. Подать заявление могут физические лица, руководители юридических лиц, индивидуальные предприниматели и граждане, планирующие начать предпринимательскую деятельность. Заявку зарегистрируют в течение 1 рабочего дня (памятка о дальнейших действиях выдаётся сразу после оформления обращения). После регистрации заявки вы получите памятку о дальнейших действиях.  Затем с вами свяжется Удостоверяющий центр и сообщит о дальнейших действиях (заключение договора, выставление счета, предоставление необходимых документов в Удостоверяющий центр, удостоверение личности и т.д.) Воспользуйтесь поиском, чтобы узнать, в каком из ближайших центров можно получить
                                    эту услугу. Примените фильтр, чтобы увидеть сроки и документы для вашей ситуации"
